{
  "$schema": "../schemas/node.schema.json",
  "argument_order": [
    "cast_shadow",
    "close_bottom",
    "close_top",
    "columns",
    "display",
    "file_menu",
    "file_menu_lbl",
    "geo_select",
    "height",
    "matrix",
    "pivot_rotate",
    "pivot_translate",
    "radius",
    "receive_shadow",
    "render_mode",
    "rot_order",
    "rotate",
    "rows",
    "scaling",
    "selectable",
    "skew",
    "snap_menu",
    "snap_menu_lbl",
    "transform",
    "translate",
    "u_extent",
    "uniform_scale",
    "useMatrix",
    "xform_order"
  ],
  "arguments": {
    "cast_shadow": {
      "capabilities": {
        "animated": false,
        "enabled": true,
        "has_expression": false,
        "visible": true
      },
      "classification": {
        "public": true,
        "reasons": []
      },
      "default": {
        "confidence": "scanner",
        "source": "nuke.Knob.defaultValue()",
        "value": 1.0
      },
      "description": {
        "format": "plain_text",
        "source": "nuke.Knob.tooltip()",
        "text": "When enabled the object can cast shadows."
      },
      "id": "arg:cast_shadow",
      "knob_type": "Boolean_Knob",
      "label": "cast shadow",
      "name": "cast_shadow",
      "python_type": "bool",
      "python_type_source": "generator_type_map_v1",
      "raw_script": "true",
      "shape": {
        "array_size": 1,
        "dimensions": 1,
        "height": 1,
        "width": 1
      },
      "values": {
        "kind": "examples",
        "source": "generator_reference_examples",
        "values": [
          true,
          false
        ]
      }
    },
    "close_bottom": {
      "capabilities": {
        "animated": false,
        "enabled": true,
        "has_expression": false,
        "visible": true
      },
      "classification": {
        "public": true,
        "reasons": []
      },
      "default": {
        "confidence": "scanner",
        "source": "nuke.Knob.defaultValue()",
        "value": 0.0
      },
      "description": {
        "format": "plain_text",
        "source": "nuke.Knob.label()",
        "text": "close bottom"
      },
      "id": "arg:close_bottom",
      "knob_type": "Boolean_Knob",
      "label": "close bottom",
      "name": "close_bottom",
      "python_type": "bool",
      "python_type_source": "generator_type_map_v1",
      "raw_script": "false",
      "shape": {
        "array_size": 1,
        "dimensions": 1,
        "height": 1,
        "width": 1
      },
      "values": {
        "kind": "examples",
        "source": "generator_reference_examples",
        "values": [
          true,
          false
        ]
      }
    },
    "close_top": {
      "capabilities": {
        "animated": false,
        "enabled": true,
        "has_expression": false,
        "visible": true
      },
      "classification": {
        "public": true,
        "reasons": []
      },
      "default": {
        "confidence": "scanner",
        "source": "nuke.Knob.defaultValue()",
        "value": 0.0
      },
      "description": {
        "format": "plain_text",
        "source": "nuke.Knob.label()",
        "text": "close top"
      },
      "id": "arg:close_top",
      "knob_type": "Boolean_Knob",
      "label": "close top",
      "name": "close_top",
      "python_type": "bool",
      "python_type_source": "generator_type_map_v1",
      "raw_script": "false",
      "shape": {
        "array_size": 1,
        "dimensions": 1,
        "height": 1,
        "width": 1
      },
      "values": {
        "kind": "examples",
        "source": "generator_reference_examples",
        "values": [
          true,
          false
        ]
      }
    },
    "columns": {
      "capabilities": {
        "animated": false,
        "enabled": true,
        "has_expression": false,
        "visible": true
      },
      "classification": {
        "public": true,
        "reasons": []
      },
      "default": {
        "confidence": "scanner",
        "source": "nuke.Knob.defaultValue()",
        "value": 30.0
      },
      "description": {
        "format": "plain_text",
        "source": "nuke.Knob.tooltip()",
        "text": "The maximum columns is 512"
      },
      "id": "arg:columns",
      "knob_type": "Array_Knob",
      "label": "",
      "name": "columns",
      "python_type": "float",
      "python_type_source": "generator_type_map_v1",
      "raw_script": "30",
      "shape": {
        "array_size": 1,
        "dimensions": 1,
        "height": 1,
        "width": 1
      },
      "values": {
        "kind": "examples",
        "source": "generator_reference_examples",
        "values": [
          30.0,
          0.0,
          0.5,
          1.0
        ]
      }
    },
    "display": {
      "capabilities": {
        "animated": false,
        "enabled": true,
        "has_expression": false,
        "visible": true
      },
      "classification": {
        "public": true,
        "reasons": []
      },
      "default": {
        "confidence": "scanner",
        "raw": 4.0,
        "source": "nuke.Knob.defaultValue()",
        "value": "textured"
      },
      "description": {
        "format": "plain_text",
        "source": "nuke.Knob.tooltip()",
        "text": "How to draw in 3D preview.  The viewer can override this setting."
      },
      "id": "arg:display",
      "knob_type": "Enumeration_Knob",
      "label": "",
      "name": "display",
      "python_type": "str",
      "python_type_source": "generator_type_map_v1",
      "raw_script": "textured",
      "shape": {
        "array_size": 1,
        "dimensions": 1,
        "height": 1,
        "width": 1
      },
      "values": {
        "kind": "allowed_values",
        "source": "nuke.Knob.values()",
        "values": [
          "off",
          "wireframe",
          "solid",
          "solid+wireframe",
          "textured",
          "textured+wireframe"
        ]
      }
    },
    "file_menu": {
      "capabilities": {
        "animated": false,
        "enabled": true,
        "has_expression": false,
        "visible": true
      },
      "classification": {
        "public": true,
        "reasons": []
      },
      "default": {
        "confidence": "fallback",
        "source": "fresh_node_initial_value",
        "value": 0.0
      },
      "description": {
        "format": "plain_text",
        "source": "nuke.Knob.tooltip()",
        "text": "Allows you to import transformation data from an external file or export existing transformation data to an external file"
      },
      "id": "arg:file_menu",
      "knob_type": "Menu_Knob",
      "label": "@FolderIcon",
      "name": "file_menu",
      "python_type": "float",
      "python_type_source": "generator_type_map_v1",
      "raw_script": "Axis/File",
      "shape": {
        "array_size": null,
        "dimensions": null,
        "height": null,
        "width": null
      },
      "values": {
        "kind": "examples",
        "source": "generator_reference_examples",
        "values": [
          0.0,
          0.5,
          1.0
        ]
      }
    },
    "file_menu_lbl": {
      "capabilities": {
        "animated": false,
        "enabled": true,
        "has_expression": false,
        "visible": true
      },
      "classification": {
        "public": true,
        "reasons": []
      },
      "default": {
        "confidence": "fallback",
        "source": "fresh_node_initial_value",
        "value": ""
      },
      "description": {
        "format": "plain_text",
        "source": "nuke.Knob.label()",
        "text": "Transform Data"
      },
      "id": "arg:file_menu_lbl",
      "knob_type": "Text_Knob",
      "label": "Transform Data",
      "name": "file_menu_lbl",
      "python_type": "str",
      "python_type_source": "generator_type_map_v1",
      "raw_script": null,
      "shape": {
        "array_size": null,
        "dimensions": null,
        "height": null,
        "width": null
      },
      "values": {
        "kind": "none",
        "source": "none",
        "values": []
      }
    },
    "geo_select": {
      "capabilities": {
        "animated": false,
        "enabled": true,
        "has_expression": false,
        "visible": true
      },
      "classification": {
        "public": true,
        "reasons": []
      },
      "default": {
        "confidence": "fallback",
        "source": "fresh_node_initial_value",
        "value": 0.0
      },
      "description": {
        "format": "plain_text",
        "source": "none",
        "text": ""
      },
      "id": "arg:geo_select",
      "knob_type": "GeoSelect_Knob",
      "label": "",
      "name": "geo_select",
      "python_type": "str",
      "python_type_source": "generator_type_map_v1",
      "raw_script": null,
      "shape": {
        "array_size": null,
        "dimensions": null,
        "height": null,
        "width": null
      },
      "values": {
        "kind": "example",
        "source": "scanner_initial_value",
        "values": [
          0.0
        ]
      }
    },
    "height": {
      "capabilities": {
        "animated": false,
        "enabled": true,
        "has_expression": false,
        "visible": true
      },
      "classification": {
        "public": true,
        "reasons": []
      },
      "default": {
        "confidence": "scanner",
        "source": "nuke.Knob.defaultValue()",
        "value": 2.0
      },
      "description": {
        "format": "plain_text",
        "source": "none",
        "text": ""
      },
      "id": "arg:height",
      "knob_type": "Array_Knob",
      "label": "",
      "name": "height",
      "python_type": "float",
      "python_type_source": "generator_type_map_v1",
      "raw_script": "2",
      "shape": {
        "array_size": 1,
        "dimensions": 1,
        "height": 1,
        "width": 1
      },
      "values": {
        "kind": "examples",
        "source": "generator_reference_examples",
        "values": [